Mezzo,Wed Sep,RT george capen The thing realDonaldTrump fears the most with the Kavanaugh nomination is that it will motivate all women to rise up in,0.5,0.5
kjd,Wed Sep,RT NatashaBertrand New Trump s directive to the FBI amp DOJ this week was remarkable But one of the more bizarre subplots in the ongoing s,0.44659090909090904,0.5761363636363637
Joel,Wed Sep,RT DeionGottaSTFU I knew the Steelers wasn t winning shit this year as soon as I found out that Big Ben had sloppy seconds after Donald T,-0.029166666666666674,0.6000000000000001
Richard Haywood,Wed Sep,RT politvidchannel Chris Cuomo RIPS Trump s former aide David Urban for wanting Kavanaugh confirmed without investigation https t co A,0.13333333333333333,0.3333333333333333
Astartiel Inanna,Wed Sep,RT Astartiel senorrinhatch ChuckGrassley There is no FBI investigation because they might find credible evidence of wrongdoing while t,0.4,0.7
roy fletcher,Wed Sep,RT TomFitton Massive beyond measure RealDonaldTrump s declassification transparency order is major blow against the Deep State and for,0.020833333333333332,0.6333333333333333
Pops,Wed Sep,LawBadger LindseyGrahamSC Investigate off what exactly She doesn t have any specifics She s anti trump and ha https t co LjbhAmjXDO,0.25,0.25
Linda Watson,Wed Sep,realDonaldTrump Excuse me bit you don t speak for everybody so your meme is inaccurate more love Trump only https t co bOddegzUpj,0.2375,0.5375
Shirley friday,Wed Sep,RT jaazee NEWS Not to the world but a story hidden from MSNBC viewers brainwashed with leftist PROPAGANDA BOMBSHELL FBI couldn t p,-0.10555555555555556,0.3444444444444445
Bogie,Wed Sep,RT VicrdrJohn ConservaMomUSA realDonaldTrump HillaryClinton I ll take that bet Of the things I ve learned over the past two years th,-0.25,0.25
Mahsa,Wed Sep,RT ShawtysLikeA Does your buddy Trump know you re learning Farsi cuz https t co DjL wvBf r,0.0,0.0
LittleHugger,Wed Sep,RT BruceAHeyman As the former US Ambassador to Canada during BarackObama second term I can say with a high degree of confidence realDon,0.05333333333333334,0.17999999999999997
Super Elite Kathleen,Wed Sep,RT MrsMalindo CountryPhy They won t be happy that EVERYBODY gets to see who were behind the Obama DOJ FBI amp possibly CIA ODNI and wha,0.13333333333333333,0.9
Zoe Stein,Wed Sep,RT degrilla MSNBC Trump is a con man and grifter not an evil genius JoeNBC,-1.0,1.0
Shaune Stark,Wed Sep,RT ladydwinter Gregg Jarrett If Rod Rosenstein defies Trump s order to declassify documents he should be fired https,0.0,0.0
CO,Wed Sep,Fahrenheit Get over it he is our president I voted for Obama and wasn t happy Who is the lesser evil Trump o https t co WXnP BeAq,-0.06666666666666665,0.8333333333333334
Karl dagenais,Wed Sep,RT bbynum BlueRobotDesign realDonaldTrump To bad we fully support President Donald J Trump and by the way we love world peace,-0.09999999999999992,0.6333333333333333
altheguy,Wed Sep,Great news,0.8,0.75
Carlos Rosado,Wed Sep,RT EdKrassen Trump is refusing to ask the FBI to investigate the sexual assault allegations against Brett Kavanaugh The FBI can t inves,0.5,0.8333333333333334
Pat Bergeron,Wed Sep,RT politico Kavanaugh crisis bonds Trump with wary GOP https t co ooxCWnxVww,-0.5,0.7
Jos Alvarenga,Wed Sep,RT Phill Liep engra ado lembrar como se constr i um cen rio cr vel a partir da releitura da pr pria pol tica brasileira Aqui n o os,0.0,0.0
ForthrightFox J,Wed Sep,FoxBusiness WhiteHouseCEA https t co AgshIYKb,0.0,0.0
Joy,Wed Sep,RT AltNatSecAgency Why He s protecting national security and not allowing a fucking clown like realDonaldTrump to make this into even m,-0.6,0.8
IncognitoUndercover,Wed Sep,RT SaraCarterDC GOP Lawmakers Laud Trump s Order to Declassify FISA Docs Sara A Carter https t co X STao KmC,0.0,0.0
Karen Schmitz,Wed Sep,RT Martina Tucker Carlson Blames Sexual Assault Victims For Not Going To The Police it s your obligation Tucker to believe all the women,0.5,0.8333333333333334
Hugh Ann Cry,Wed Sep,RT GeorgeTakei Bob Woodward s book Fear has sold almost as many copies in one week as Art of the Deal sold in years If asked to c,0.5,0.5
pablo,Wed Sep,RT ericschwartz Trump ejects Univision s Jorge Ramos from news conference Meanwhile the hottest toy in Mexico is the Trump pi ata http,0.0,0.0
Aceairdog,Wed Sep,KrisParonto SACPAC Comey JohnBrennan CIA Plot against Kavanaugh https t co HgVCkXQl,0.0,0.0
Rob,Wed Sep,Trump is no fool He sees right through this tactic They did it to Clarence Thomas Why not give it another try,0.2857142857142857,0.5357142857142857
Bob Paust,Wed Sep,SenSchumer Chuck you really think real Americans believe one word that you say You need to see a Doctor cause yo https t co yrDMs QDgd,0.2,0.25
Linda Murray,Wed Sep,RT realDonaldTrump The recovery got started on Election Day It took Trump s Tax Cuts and Regulation Cuts to get the economy boomin,0.0,0.0
Terry Greer,Wed Sep,theterriblefan RosannaMaga dbongino Craig I think it means that Trump has done more for this country i https t co jJ b PNN,0.5,0.5
Johnny Macon,Wed Sep,AndyOstroy realDonaldTrump Yep he s still trying to associate having a good economy will some how ease pain of hi https t co zHtDNhA Z,0.7,0.6000000000000001
,Wed Sep,RT Arthursabulaev MileyCyrus KatyPerry JuliaRoberts Trump MichaelJackson https t co n vOle https t co QMb MLvssT,0.0,0.0
Tomchapman,Wed Sep,RT GreggJarrett If Rod Rosenstein defies Trump s order to declassify documents he should be fired https t co q wlw s Zo,0.0,0.0
Sandyriccobono,Wed Sep,RT wwwillstand Goodnight followers and Patriots let s all say a prayer for Donald Trump and get out and help this man get America back an,0.0,0.0
Sarah resists,Wed Sep,RT QIsFake JDW raba mary fasteddyTO TimW guage lester GOPisTreasonous AgreePlay abillionshivas TomZBHappy Qanon is fake,-0.5,1.0
Jenny Luckie,Wed Sep,RT GeorgeTakei Bob Woodward s book Fear has sold almost as many copies in one week as Art of the Deal sold in years If asked to c,0.5,0.5
Jason Smith,Wed Sep,RT realDonaldTrump The recovery got started on Election Day It took Trump s Tax Cuts and Regulation Cuts to get the economy boomin,0.0,0.0
Aaron Birks,Wed Sep,RT Puncroaker BREAKING The new Head of Communications for the Trump administration is revealed to be a Miss Ann Thrope PUN,0.13636363636363635,0.45454545454545453
Ruben Garcia,Wed Sep,RT thehill Trump administration can t locate migrant children it moved from federal shelters report https t co qOZi oByNS https,0.0,0.0
marcus aurelius,Wed Sep,RT thehill BREAKING Trump eviscerates Sessions I have no attorney general https t co PyVAj gUOe https t co a uR oxAoq,0.05000000000000002,0.5
blackmacadamia,Wed Sep,RT MomoAdalois HapsatouSy Comment c est possible on se dirait dans l amerique de Trump,0.0,1.0
diannabythesea,Wed Sep,RT MSNBC Hillary Clinton to Maddow on th Amendment discussions about President Trump I do think there are probably private discussio,0.0,0.375
Vichy GOP,Wed Sep,BillyBaldwin CondreayDavid Donald J Trump Has Never Had the Blues We hope our song will help fight the good f https t co vihyVNkTmz,0.7,0.6000000000000001
Diddy McC,Wed Sep,RT ajamubaraka While the people are entertained by the Trump saga the steady state continues advancing its aggressive agenda in Syria a,0.16666666666666666,0.5
JFK,Wed Sep,RT lady shoes RED ALERT RED ALERT DO YOU RECOGNIZE THIS LEFT WING RADICAL ANTI TRUMP PROTESTER SHE IS THE PROFESSOR WHO IS MAKING T,0.0,0.0
H ritierDeLaR sistance,Wed Sep,Watch The National Toy Hall of Fame amp The Trump Magic Ball The Daily Show on YouTube https t co gL M dCUjr,0.25,0.5
Steve A,Wed Sep,RT Lukewearechange Obama not only worsened the refugee crisis in Syria but also helped bring back slavery and human trafficking to Lybia,0.0,0.3666666666666667
Reta Klase,Wed Sep,RT SaraCarterDC GOP Lawmakers Laud Trump s Order to Declassify FISA Docs Sara A Carter https t co X STao KmC,0.0,0.0
Sovereignty,Wed Sep,RT BarbaraRedgate Crooked Criminal HillaryClinton Must Be Prosecuted For Knowingly Sharing Classified Information On Her Private Server,-0.13333333333333333,0.3416666666666666
Tired of Winning Yet,Wed Sep,RT Levendaki Well among the majority of the majority of women voted for Lying Traitorous Trump despite knowing that he s a,0.0,0.0
Azih,Wed Sep,RT mehdirhasan The same right wing bloggers who accuse Corbyn of anti Semitism praise Steve Bannon who was the mastermind behind a ridi,-0.038095238095238106,0.45357142857142857
Terri,Wed Sep,ChatByCC realDonaldTrump So you elect someone so corrupt and destructive as Trump a man who is a pathological li https t co RA yBn l,-0.09999999999999998,0.8333333333333334
Deplorable in Ohio,Wed Sep,RT GreggJarrett If Rod Rosenstein defies Trump s order to declassify documents he should be fired https t co q wlw s Zo,0.0,0.0
Cheri Jacobus,Wed Sep,Male Trump supporter,0.0,0.1
Scott Strumello,Wed Sep,RT POLITICOMag Al Stapleton a year old retired Teamster in Ohio says he voted for Trump to kick corporate asses and drain the swamp,0.05,0.1
Lothar G Kopp,Wed Sep,testitest ger Fischhausen arndhenze AnneWillTalk bmi Jedenfalls ist die CDU nach links ger ckt und hat dadur https t co RQESQMwj s,0.0,0.0
Mar,Wed Sep,RT jonathanchait Trump and Kavanaugh are going to be poison for the pro life movement argues DouthatNYT in a striking and original colu,0.4375,0.875
Stacy Jannis,Wed Sep,NatashaBertrand To follow up what kind of energy documents did Page give to Russian spies in Why did he sug https t co JqeC XoGL,0.3,0.45
Holyspirithouse,Wed Sep,RT realDonaldTrump The recovery got started on Election Day It took Trump s Tax Cuts and Regulation Cuts to get the economy boomin,0.0,0.0
debbie martinsen,Wed Sep,RT bulldoghill The Trump administration is unable to account for the whereabouts of nearly migrant children who illegally entered t,-0.3,0.4666666666666666
KimberlyColoradoTrump,Wed Sep,RT realDonaldTrump The recovery got started on Election Day It took Trump s Tax Cuts and Regulation Cuts to get the economy boomin,0.0,0.0
Pumpkin pie maker,Wed Sep,RT TheBadDadder If you re as fed up with the Mueller investigation as I am I encourage you to peruse this thread I wrote over the pas,0.0,0.0
Theresa,Wed Sep,RT RealJamesWoods Luckily you won t be dealing with any of that because you aren t the President of the United States Donald Trump is,0.3333333333333333,0.8333333333333334
Alan Casey,Wed Sep,RT jpitney Until today my favorite example of redundancy was to dismiss the case would be unprecedented from a historical standpoint b,0.3666666666666667,0.6333333333333333
Wooglin,Wed Sep,thehill Yet Trump demands respect and loyalty Hypocrite,0.0,0.0
Amy Roomato,Wed Sep,RT Italians Trump Grassley Says He Won t Delay Kavanaugh Hearing As Moderate Republicans FALL IN LINE Democrats Hail Mary play to stym,0.0,0.7
LGWIZ,Wed Sep,RT mitchellvii RESULTS people THIS is why we elected Trump https t co kbjgNkhmiw,0.0,0.0
Enrique Fern ndez,Wed Sep,https t co xVtgGiYm U,0.0,0.0
Theresa eden,Wed Sep,RT MAGAourcountry ConfirmKavanaugh https t co tngQq GwfD,0.0,0.0
Sapphire,Wed Sep,RT TrumpGirlStrong TrumpDerangementSyndrome SHAMEFUL CNN Bottoms Out With Segment On Trump s Private Parts https t co p TJaszgq,0.0,0.375
Alma R Mercado,Wed Sep,RT RichardGrenell BASF will comply with US sanctions on Iran https t co A YwhQoHD,0.0,0.0
Ruby Guyatt,Wed Sep,RT doctor oxford BREAKING Report reveals what Rees Mogg and co really have in mind for post Brexit Britain An ideal UK US trade dea,0.55,0.6
uveschu,Wed Sep,RT PrisonPlanet Top Democrats have called on deep state members of the FBI and the Department of Justice to sabotage President Trump s or,0.25,0.45
Doug Guy,Wed Sep,emmajthatcher wildwillow Emma I m afraid it might be up to your generation to fix our society past generation https t co YWymuC q j,-0.425,0.575
Chris Cillizza,Wed Sep,They used Carter Page as a foil in order to surveil a candidate for the presidency of the United States Donal https t co KyI ClirSt,0.0,0.0
J B,Wed Sep,RT kilmeade President Trump reacts after Kim Jong Un agrees to dismantle nuke site Garrett FoxNews https t co Jd VwzFpm,0.0,0.0
Adorable Dregplorable Jeannie,Wed Sep,RT drawandstrike Who in the WORLD assured these Democratic Senators that anyone in the White House hadn t seen these documents unredact,0.0,0.0
Gav FBPE FBR,Wed Sep,Is it acceptable to laugh at Donald Trump s mushroom Yes it is next question Trump https t co LLlQaRlZpJ,0.15,0.05
PROTECTALLCHILDREN,Wed Sep,America doesn t have a president It s horrifying,-0.9,1.0
Mrs VIP KAG,Wed Sep,CONSTITUTIONAL CRISIS Pelosi Schumer Schiff and Warner DEMAND DOJ FBI Defy Trump Declassification Order https t co l ilgxbm,0.0,0.0
arya setianegara,Wed Sep,The violence is always there life as a Sikh in Trump s America https t co LfDLNoqtBK,0.0,0.0
,Wed Sep,RT ianbremmer Trump I don t have an attorney general It s very sad https t co Xs h vF y,-0.3,0.75
alicryptolife,Wed Sep,RT fusepetal This will certainly feed the US Commander in Chief s ego Shoot me now https t co yloE NJB,0.21428571428571427,0.5714285714285714
Bill Brooks,Wed Sep,RT TDPattillo What happens at Georgetown Prep stays at Georgetown Prep What happens in Trump Tower stays in Trump Tower What h,0.0,0.0
L G Coleman,Wed Sep,RT GPN Bob Woodward I Looked For Two Years There s No Evidence Of Trump Russia Collusion https t co Yv SMacmEL,0.0,0.0
Laurie Olsen,Wed Sep,RT RealJamesWoods Luckily you won t be dealing with any of that because you aren t the President of the United States Donald Trump is,0.3333333333333333,0.8333333333333334
Christine,Wed Sep,Your tax cuts just brought you amp the rich more you NEVER helped the rest of Americans You are just a very s https t co vNqrxriuBf,0.35833333333333334,0.5166666666666667
Doxie Trump,Wed Sep,RT Thomas Paine FBI Official FBI Agents Threatened Physical Harm to President Trump In Missing FBI Texts amp Other Frightening Commun,-0.20625,0.3919642857142857
Matt Cameron,Wed Sep,If only,0.0,1.0
Ronald W Lewis,Wed Sep,RT AmoneyResists Here s Donald Trump on August th when asked what his take is regarding the Anita Hill Clarence Thomas controvers,0.0,0.0
Balthazar Bratt,Wed Sep,CHIMPSINSOCKS I got banned for calling Trump a cunt Mad to see what you can say post on here and not get banned but say THAT,-0.625,1.0
yourmamatoo,Wed Sep,RT bron What else is new the coup is peaking send in the marshals https t co Dm PjlgeO,0.13636363636363635,0.45454545454545453
Ryan Carter,Wed Sep,So I tried to sneak into the UK but PrinceHarry got the Bobby police to rough me up You see this https t co FeBWlgUs,-0.1,0.4
MarionSarahB,Wed Sep,RT TeaPainUSA And the American people have no president It s a matched set https t co Ruq hPbO,0.0,0.0
robertwojtowicz,Wed Sep,RT NiezaleznyPolak Nikomu w Stanach nie umkn a mina Trumpa po s owach PAD nt nazwania nowej ameryka skiej militarnej bazy Fort Trump h,0.0,0.0
Marie Titus,Wed Sep,RT TrueFactsStated Our international shipping site Free shipping on orders of or more https t co Q eafLjm,0.3,0.43333333333333335
R E Moscoso,Wed Sep,RT Lucy Say the truth that is San Juan abandon by the worst Mayor ever all she has done during the pass of the hurricane is cam,-1.0,1.0
,Wed Sep,RT realDonaldTrump The recovery got started on Election Day It took Trump s Tax Cuts and Regulation Cuts to get the economy boomin,0.0,0.0
Citizens Fed Up,Wed Sep,RT d andone VOTE DEMS Demand Kavanaug take FBI Polygraph like DR Ford had too GOP Statements on Rape https t co pWm gv mDB GOP Rapi,0.0,0.0
Arlene GTTO,Wed Sep,RT StrongerStabler Groups linked to Trump amp International Sec Liam Fox want to open up the NHS to competition from the US get rid of sw,-0.03333333333333333,0.3666666666666667
Bruce Hoffman,Wed Sep,NBCNews So when has the law ever stopped trump from doing anything,0.0,0.0
mapeje,Wed Sep,RT velardedaoiz Estamos asistiendo aparentemente al fin de la Guerra en Corea Aunque creo que har an bien Trump y EEUU en no fiarse un,0.0,0.0
Sherry Lee Campbell,Wed Sep,RT thehill CNN anchor tears into Trump for calling Kavanaugh accuser the woman https t co GpXEPWweAQ https t co susMjBlVzR,0.0,0.0
Say When,Wed Sep,RT realDonaldTrump The recovery got started on Election Day It took Trump s Tax Cuts and Regulation Cuts to get the economy boomin,0.0,0.0
Emily the Bulbasaur dipshit anarchist,Wed Sep,RT samknight one What are the odds he has said this at least twenty times before except replace Attorney General with son and Jeff,-0.12499999999999999,0.45
Douglas Rosebrock,Wed Sep,RT bulldoghill The release of FISAs like this is off the charts one former Justice Department official wrote Another former federal p,0.0,0.0
Ted Blake,Wed Sep,RT RealJamesWoods Does that include Mr Ed https t co p CReXKOrl,0.0,0.0
Wendy Hulett,Wed Sep,RT RealJack RETWEET to trigger a Democrat Did you know Kim Jong Un just reportedly told the visiting South Korean leader that the J,0.0,0.0
Node,Wed Sep,RT ThomasWictor Fred Trump described his son s efforts to buy the Commodore Hotel as fighting for a seat on the Titanic But D,0.0,0.0
joyce,Wed Sep,RT tonyschwartz Takeaway from Woodward s Fear Trump doesn t have much money As Jared Kushne put itr HJe doesn t have a lot of cas,0.2,0.2
DeDe Rhodes,Wed Sep,RT MrRobotCodeBrkr The party that elected Donald Trump and supported Roy Moore is not going to let Brett Kavanaugh s tendency to rape sto,0.0,0.0
Muhammad G Ibrahim,Wed Sep,RT adam omakarr This nigga Trump took it too far He in the cloud looking for immigrants https t co bVrnXm KL,0.1,1.0
BeeNewsDaily,Wed Sep,RT WPJohnWagner I should have fired him before I got here Trump says he regrets not firing Comey sooner w mattzap https t co TAUp,-0.1,0.2
Ernie,Wed Sep,RT FoxNews OPINION Marc Thiessen Chaos or not Trump is racking up a record of foreign policy success https t co cg D vJWs,0.0875,0.0625
GrabGooglebytheYoutube,Wed Sep,RT FoxNews GreggJarrett If Rod Rosenstein defies Trump s order to declassify documents he should be fired https t co luYE qJVNn,0.0,0.0
karen lindley,Wed Sep,RT StephenKing In Richard Red Tide Rick Scott cut million from the Florida Water Management District Now the Gulf Coast is,0.0,0.0
Super Trump,Wed Sep,RT RealJamesWoods Yes You re all so worried about the ramifications for the midterms Just call the vote and live or die with it That s,0.13636363636363635,0.5
FoggyBottomGal,Wed Sep,RT BobBrigham Just not who we are Bozeman Montana tavern refuses DonaldJTrumpJr and kimguilfoyle MTpol MTsen MTnews https,0.0,0.0
gregorymcmahon,Wed Sep,RT smalltownandrew Calling Florida patriots President Trump needs your help We need to get out and vote in November and give potus the,0.0,0.0
Aislinn,Wed Sep,RT thehill Trump administration can t locate migrant children it moved from federal shelters report https t co qOZi oByNS https,0.0,0.0
Mr X Cannot be Hindered by Mortal Man,Wed Sep,RT C to I m not being edgy I m not being inflammatory At what point will Trump simply force compliance from his own government This,0.09999999999999999,0.7023809523809524
Patty Basham,Wed Sep,RT GreggJarrett If Rod Rosenstein defies Trump s order to declassify documents he should be fired https t co q wlw s Zo,0.0,0.0
Marie Marotto,Wed Sep,pjlacasse thehill Please keep posting this reminder because trump s TREASON invalidates his presidency and everything he does,0.0,0.0
WarriorMom,Wed Sep,RT TheRickWilson This is delicious The arsonist covered in soot reeking of kerosene and singed hair comes staggering out of the buildi,1.0,1.0
VLv,Wed Sep,RT StephenKing In Richard Red Tide Rick Scott cut million from the Florida Water Management District Now the Gulf Coast is,0.0,0.0
Rockie Springer,Wed Sep,RT PrisonPlanet Top Democrats have called on deep state members of the FBI and the Department of Justice to sabotage President Trump s or,0.25,0.45
Krista Franz,Wed Sep,RT ladydwinter Gregg Jarrett If Rod Rosenstein defies Trump s order to declassify documents he should be fired https,0.0,0.0
Jeff A Taylor,Wed Sep,To the Trust the Plan clan this is code for Sessions has assumed the role of Grand Marshal of the UN and will begin https t co jREglcAPLY,0.5,1.0
nhspirit,Wed Sep,RT DonaldJTrumpJr Translation they want to stall as long as possible and redact more than nescessary to cover up for themselves Give me,0.15,0.6333333333333333
Tifenn,Wed Sep,RT Youva YL Askip trump a une fille qui s fait tt ltemps sauter el sapl trump pauline,0.0,0.0
Matt Nesto,Wed Sep,fun with numbers how small temporary percentage moves in an enormous economy can be used to make any point you wa https t co TXYIQJ TXR,0.016666666666666663,0.5
Shannon,Wed Sep,RT JulianSvendsen North and South Korea will file a joint bid to host the Olympics will they thank President Trump Please help by,0.0,0.0
Jon Jimmie,Wed Sep,LOL the new trump emergency codes,0.4681818181818182,0.5772727272727273
Mike,Wed Sep,RT mmpadellan This one s gonna REALLY set off trumplethinskin Hillary Clinton I don t know whether trump is a witting or unwitting,0.2,0.2
Robert Burnier,Wed Sep,TradeIdeas SenSchumer That guy was got rid of Exactly what we want with Kavanaugh Trump Not sure bringing it up helps Trumpers,0.0,0.5694444444444444
theress,Wed Sep,RT realDonaldTrump The recovery got started on Election Day It took Trump s Tax Cuts and Regulation Cuts to get the economy boomin,0.0,0.0
Misha,Wed Sep,RT OMGno trump For anyone without an economics background let me assure you Trump s tariffs are pure economic insanity He has no idea,0.20714285714285713,0.35
Logan,Wed Sep,RT FoxNews Peter Ferrara Recovery really got started on election day It took Trump s tax cuts and deregulation to get the econom,0.2,0.2
megraham,Wed Sep,ReutersWorld This is JUST TRUMP taking the pressure off of Russia,0.0,0.0
Awake AwarePez,Wed Sep,RT realDonaldTrump The recovery got started on Election Day It took Trump s Tax Cuts and Regulation Cuts to get the economy boomin,0.0,0.0
Eileen Baumgen,Wed Sep,RT MarkDice CNN is now reporting on Trump s distinctive penis not a parody https t co j xcZWOzFE,0.0,0.0
ForthrightFox J,Wed Sep,BreitbartNews https t co AgshIYKb,0.0,0.0
noelle goeckner,Wed Sep,RT MZHemingway To pick a recent but typical example your big story last week blaming the Trump administration for buying curtains ordere,-0.041666666666666664,0.22916666666666666
Mike Angarone,Wed Sep,RT RealJamesWoods Yes You re all so worried about the ramifications for the midterms Just call the vote and live or die with it That s,0.13636363636363635,0.5
Russell Rosenkild,Wed Sep,RT TeaPainUSA And the American people have no president It s a matched set https t co Ruq hPbO,0.0,0.0
EverygirlUSA,Wed Sep,RT DearAuntCrabby Donald Trump ranked worst president in US history by nearly political scientists Only https t co jHxVGY,-0.3333333333333333,0.7000000000000001
George Rangel,Wed Sep,RT chelseahandler Bert and Ernie being gay is the good news we needed after Stormy Daniels described Donald Trump s penis,0.5583333333333333,0.5916666666666668
paolovarsi,Wed Sep,Gli effetti della cura Trump sul sistema mondiale Altra deflazione https t co pI S EDlek di MaurizioBlondet,0.0,0.0
friendly memes,Wed Sep,What s up homie you should skype Donald Trump,0.0,0.0
Larry Simpson PhD,Wed Sep,Height of hypocrisy Ex prosecutor shreds GOP for insisting on Ford testimony while letting Trump avoid Mueller https t co yApzc Wt,0.0,0.0
American as Apple Pie Baklava,Wed Sep,RT jimsciutto Fact is the FBI CAN investigate Ford s allegation IF so ordered by President Trump as President Bush ordered the FBI to,0.0,0.0
Kathleen Hoffman,Wed Sep,RT bulldoghill Should Senate Judiciary Committee Chairman Charles E Grassley R Iowa continue to restrict the witness list Of course,0.0,0.0
Linda C Abbott,Wed Sep,RT ToddDomke Everything Trump Touches Dies by TheRickWilson and the reason their reputations die from collusion with Trump is becaus,0.0,0.0
Dudeist Monk,Wed Sep,None of us want this trade war with China Why doesn t Trump get that What we wanted was to have a civil discussi https t co weuvofo I,0.0,0.0
Darrell Brock,Wed Sep,RT RealJamesWoods The ElectoralCollege is the shining centerpiece of the Constitution illuminating the Founding Fathers brilliance in,0.0,0.0
Steve,Wed Sep,RT MaddowBlog Clinton It s clear Trump is playing checkers and Putin is playing three dimensional chess https t co ooI K SFdw,0.10000000000000002,0.3833333333333333
Joe Jackson,Wed Sep,lauriedtmann jaded k klingensmith j SenBobCorker ChuckGrassley GOP Please stay in the socialist lib loon part https t co atkNDkK SN,0.0,0.0
Waseem Mustafa,Wed Sep,RT AC The idea I am kneeling in water to make it look deep is idiotic AndersonCooper debunks the lies being spread by Donald Tru,-0.3333333333333333,0.6166666666666667
Cliff Potter,Wed Sep,The Hill is a right wing publication that occasionally writes somewhat neutral articles It is a Fox News wannabe https t co mN sOV G,0.14285714285714285,0.33035714285714285
Francesca Milling,Wed Sep,RT matthaig I don t see how you can be pro NHS and pro Brexit at the same time The two positions must be incompatible No matter how mu,0.0,0.125
Suzieblaze,Wed Sep,Love your thoughts Bill miss you on FOX have you signed with Serius XM yet You need your own show nan TEAM https t co drvUY zIyD,0.55,0.8
threebythree,Wed Sep,RT kbari I am guessing when you can drive a small car through your vagina No one is very impressive StormyDaniels Tramp CNN Wednesd,0.375,0.7
Alan Lewis Chambers FBPE ABTV,Wed Sep,RT StevePeers But US trade policy is currently characterised by Trump s rage tweets demanding renegotiation of FTAs imposing unilater,0.0,0.4
,Wed Sep,RT gs f PNN Bethlehem A new petition to the American congress has been published asking people to look up lawmakers,0.06818181818181818,0.22727272727272727
WalkAway,Wed Sep,RT FoxNews OPINION Marc Thiessen Chaos or not Trump is racking up a record of foreign policy success https t co cg D vJWs,0.0875,0.0625
