Lori,Wed Sep,Fabricated as usual,-0.125,0.5
Robert martell,Wed Sep,RT CarlosSimancas Hirono hates all men Lying pathetic obstructionist Democrats Trump is doing exactly what we elected him to do Th,-0.375,0.625
Shirley C,Wed Sep,RT Frank Schaeffer Sarah Huckabee was raised by a far right ideologue She was raised to lie for the right She s the perfect match for T,0.4178571428571428,0.7678571428571428
Sig Ruman,Wed Sep,brithume BostonMaggie AndrewCMcCarthy And it began to get Trump,0.0,0.0
CGG,Wed Sep,RT SaraCarterDC GOP Lawmakers Laud Trump s Order to Declassify FISA Docs Sara A Carter https t co X STao KmC,0.0,0.0
Mic,Wed Sep,RT painefultruths The reunification of spirit between the Korean peoples will be just one of Trump s many lasting legacies https t co,0.25,0.25
Donna Valente,Wed Sep,RT MoaninMary Don t get comfortable with these polls saying dems r leading in midterms Prop games r being played by ppl participating in,0.4,0.8
Melanie Van,Wed Sep,RT stroudsburger I m no economist but if Trump raises tariffs on Chinese imports the Chinese raise prices to offset the higher cost of,0.08333333333333333,0.16666666666666666
Henry Yearwood,Wed Sep,RT SaraCarterDC GOP Lawmakers Laud Trump s Order to Declassify FISA Docs Sara A Carter https t co X STao KmC,0.0,0.0
Nancy Hoffman,Wed Sep,RT TDPattillo realDonaldTrump FoxNews North Korea lies again Trump believes their lies again,0.0,0.0
Vivek Sahu,Wed Sep,Iam Prerna ShefVaidya RahulGandhi INCIndia Chipak hi gye Iam Prerna aap to Trump ki mahila karykarta se jaise https t co fpKAV aK,0.0,0.0
Bigboomer,Wed Sep,RT WhiteHouse President Trump s economy is the rising tide that is lifting all boats This is especially true for Hispanics who were am,0.7,1.0
Jeanos,Wed Sep,RT I Exude Sarcasm OH HE STUPID stupid https t co K LJm agPO,-0.7999999999999999,1.0
DC Cajun,Wed Sep,American Politics Has Caught Up with Right Wing Populist Dinesh D Souza On the last day of May the right wing pop https t co PuEX O us,0.14285714285714285,0.2845238095238095
Moe,Wed Sep,RT realDonaldTrump The recovery got started on Election Day It took Trump s Tax Cuts and Regulation Cuts to get the economy boomin,0.0,0.0
Debbie Cross,Wed Sep,RT TheGoodGodAbove Trump is now the first search result when you Google Idiot Mushroom dick Russian treason,-0.18333333333333335,0.37777777777777777
Goldensrule,Wed Sep,RT TheDemCoalition Prices will jump on everything from baby furniture to canned tuna when the latest round of asinine Trump induced tarif,0.15,0.65
Debra,Wed Sep,RT jeneps One of the wettest we ve ever seen from the standpoint of water is how Trump describes Hurricane Florence in a pre taped vide,0.0,0.0
Chris Wire,Wed Sep,RT MZHemingway To pick a recent but typical example your big story last week blaming the Trump administration for buying curtains ordere,-0.041666666666666664,0.22916666666666666
America First NRA member MAGA,Wed Sep,RT ForthrightFox J POLL September Gregg Jarrett If Rod Rosenstein defies Trump s order to declassify documents he should be,0.0,0.0
Wendy,Wed Sep,RT LoadingMagazine Lil Skies performing Donald Trump by Mac Miller at Rolling Loud LilSkies https t co dvV fMSYbR,0.1,0.8
SunShine,Wed Sep,RT bbusa Daughter Of CIA Assassin Paymaster Tries To Bring Down Trump Supreme Court Nominee Kavanaugh https t co J IBsoew E SO DR,-0.1277777777777778,0.34444444444444444
Derek Gilbert,Wed Sep,Democrats Call on Deep State to Sabotage Trump s Order to Declassify Russia Investigation Docs https t co v S ZZ Lf,0.0,0.4
The Godmother,Wed Sep,RT Frank Schaeffer Sarah Huckabee has repeatedly said that she doesn t lie when at the podium But many of her public statements have lat,0.25,0.2833333333333333
Jenny,Wed Sep,RT chelseahandler Bert and Ernie being gay is the good news we needed after Stormy Daniels described Donald Trump s penis,0.5583333333333333,0.5916666666666668
TIME,Wed Sep,President Trump s trade war with China got bigger Here s what that means for your investments https t co DdutBiX LW,0.0,0.5
No Name Bandit,Wed Sep,RT MsMelChen I enjoy a good dick joke but it should be sufficient to just criticize Trump s policies without dragging his pecker into th,0.55,0.55
PASTOR BRENDA BUCK,Wed Sep,RT SaraCarterDC GOP Lawmakers Laud Trump s Order to Declassify FISA Docs Sara A Carter https t co X STao KmC,0.0,0.0
Blue mom,Wed Sep,RT evanperez The president seems again to not know why AG Sessions recused in Russia probe It s because of Sessions role in the Trump c,0.0,0.0
Jeremy,Wed Sep,johncardillo I m fully expecting the FBI DOJ to stall and or flat out refuse Trump s order The bad actors still e https t co HGnAe GCwQ,-0.36249999999999993,0.3958333333333333
bdarby,Wed Sep,RT RealJack RETWEET to trigger a Democrat Did you know Kim Jong Un just reportedly told the visiting South Korean leader that the J,0.0,0.0
NeverEither,Wed Sep,PiedPiperOfIdiots https t co bRQBJrx m,0.0,0.0
Catherine Mency,Wed Sep,RT drenetol Haeser realDonaldTrump I can t stand it when you all put God amp Trump in the same sentence He spends his Sundays on the go,0.0,0.125
Rusty,Wed Sep,emrazz The Trump Effect,0.0,0.0
Shoes,Wed Sep,RT RealJamesWoods Yes You re all so worried about the ramifications for the midterms Just call the vote and live or die with it That s,0.13636363636363635,0.5
EVER TRUMP,Wed Sep,RT Lrihendry Stormy Daniels said sex with Trump was the least memorable It would be hard to remember something that never happened Lol,0.17708333333333334,0.6604166666666667
Bill Brooks,Wed Sep,RT TheAnalogKid It s when I see a picture of BarackObama smiling from ear to ear reaching out to a child or hearing him speak with,0.0,0.0
John Winterbauer,Wed Sep,LindseyGrahamSC Why s it so imperative Senator Your spineless leader SenateMajLdr thought there was no big hur https t co ft xW luE,0.0,0.1
Archangels,Wed Sep,RT PrisonPlanet Top Democrats have called on deep state members of the FBI and the Department of Justice to sabotage President Trump s or,0.25,0.45
Lodestar Cat Shelly,Wed Sep,RT MarkHertling Poland has been asking begging for more US forces of any type on their soil since Every time I went there the,0.5,0.5
The Country Patriot,Wed Sep,heyitsmeCarolyn RedPillBlackMan tdpga RealTT elguapo VanbeckVance ouchinagirl Rbigzs proudamerican https t co Hj OJ DHH,0.0,0.0
Steven LeBlanc,Wed Sep,dcexaminer Does anyone really listen to this woman anymore She lost her voice many years ago Authoritarian https t co iqNDKmg MM,0.35,0.35
Abel Pienaar,Wed Sep,RT LisaMei EXCLUSIVE Trump says exposing corrupt FBI probe could be crowning achievement of presidency https t co qO yKUv i,-0.5,1.0
Justa Rodriguez,Wed Sep,RT RT com Manhunt intensifies for survivalist who threatened to put a bullet in Trump s head https t co L IR Ao x https t co q,0.0,0.0
IndivisibleFallbrook,Wed Sep,RT politico Manafort s plea deal says that if his convictions are wiped out for any reason for example a pardon from Trump prosecutor,0.0,0.0
Diego Santiago,Wed Sep,Watch Russiagate MOAB Bombshell Trump Orders FISA Declassification and QAnon Is Proved To Be Real on YouTube https t co pEo Z LFJT,0.2,0.30000000000000004
m,Wed Sep,RT bbusa Daughter Of CIA Assassin Paymaster Tries To Bring Down Trump Supreme Court Nominee Kavanaugh https t co J IBsoew E SO DR,-0.1277777777777778,0.34444444444444444
Gayle Storm,Wed Sep,Excellent tweet Thank you Sadly no rules for Democrats only Republicans Don t expect any help from the FBI the https t co sDgIonGfKW,0.4166666666666667,1.0
Zanetta,Wed Sep,FBI Justice Dept plan to redact Russia documents despite Trump order for full declassification report https t co VYNoJjZryr,0.35,0.55
Linda Guzman,Wed Sep,RT AMErikaNGIRLBOT Breaking News Prosecutors under Rod Rosenstein are meeting with NYState prosecutors confidentially to Workout a plan,0.0,0.0
Jennifer,Wed Sep,RT GreggJarrett If Rod Rosenstein defies Trump s order to declassify documents he should be fired https t co q wlw s Zo,0.0,0.0
Tio Santiago,Wed Sep,RT sarahkendzior TV news in the background of my middle school years Rodney King Anita Hill Trump s divorce and bankruptcies the coll,0.0,0.0
Donna Davis,Wed Sep,RT SaraCarterDC GOP Lawmakers Laud Trump s Order to Declassify FISA Docs Sara A Carter https t co X STao KmC,0.0,0.0
Ray Lopez,Wed Sep,RT EdKrassen Trump is refusing to ask the FBI to investigate the sexual assault allegations against Brett Kavanaugh The FBI can t inves,0.5,0.8333333333333334
Dennis Ludolph,Wed Sep,RT PrisonPlanet Top Democrats have called on deep state members of the FBI and the Department of Justice to sabotage President Trump s or,0.25,0.45
WalkAway Mexican J Lo,Wed Sep,RT Oil Guns Merica This and CillizzaCNN lying about Trump s comments makes two gigantic lies by CNN journos in just one day Amazing ht,0.6000000000000001,0.9
Elephant Address,Wed Sep,Winning Even Liberal Washington Post has to admit Trump economy Booming with Blue Collar Jobs https t co Ga t gBMG,0.25,0.425
Caitlin,Wed Sep,RT ginadivittorio Those who deny freedom to others deserve it not for themselves and under a just God can not long retain it,0.025,0.4
JESUS F ALFONSO,Wed Sep,RT Oil Guns Merica This and CillizzaCNN lying about Trump s comments makes two gigantic lies by CNN journos in just one day Amazing ht,0.6000000000000001,0.9
Murf,Wed Sep,RT HillaryClinton Whether it was stealing a Supreme Court seat gerrymandering congressional districts to disenfranchise African American,0.0,0.0
Patrick Clayton Baughan,Wed Sep,RT Iza WednesdayWisdom WednesdayMotivation wednesdaythoughts FBICorruption WalkAway MilitaryTribunals FISAcorruption S,0.0,0.0
Brad Christy,Wed Sep,RT HLAurora The day after Trump was elected you were still drunk on Chardonnay Your utter denial and refusing to accept the outcome,-0.25,1.0
Adam R,Wed Sep,rothschildmd There s a smear going around by sources that Trump colluded with Russia Not news sources just https t co jF ixjfo Q,0.0,0.0
,Wed Sep,RT Youva YL Askip trump a une fille qui s fait tt ltemps sauter el sapl trump pauline,0.0,0.0
Karin Nemetz,Wed Sep,RT mitchellvii So let me get this straight This woman who is accusing Kavanaugh after years is an anti Trump activist her lawyer is,0.2,0.4
wildweezle,Wed Sep,RT BJSquirrel It is TERRIFYING amp not enough prople are thinking past this vote and coming to terms with the multitude of ways amp millions,-0.4166666666666667,0.5833333333333334
Marylene,Wed Sep,RT DanyLaft BB Brigitte Les US ont mal vot en lisant Obama Mais avec D Trump le pays se porte beaucoup mieux de chomage et,0.0,0.0
Anna Small Books,Wed Sep,RT SocialPowerOne Trump s Lies Have Grown Far More Frequent and More Dangerous https t co bz HVMQG C,0.12,0.6399999999999999
FiFa,Wed Sep,RT tlrd Trump Chews Up Jeff Sessions in New Interview I Don t Have an Attorney General It s Very Sad https t co vsVr oji n https,-0.15454545454545454,0.6515151515151515
river storm,Wed Sep,RT j ooch So anyone who supports Trump is a dreg of society But here you are touching women making them look uncomfortable theres more,0.16666666666666666,0.6666666666666666
Kaykay Walker,Wed Sep,RT SenSchumer The FBI tells us that the White House needs to direct them to re open their background investigation into Judge Kavanaugh,0.03333333333333333,0.3
QU es,Wed Sep,El abrigo de euros de Melania Trump que estren a pesar de los grados que hac a https t co psUM pFHIJ,0.0,0.0
The Vision Capital,Wed Sep,RT TopRopeTravis Mueller Trump proofed Manafort s plea deal If Trump pardons his former campaign chairman Manafort s deal includes a c,0.0,0.0
CatsRule,Wed Sep,RT freddyatton realDonaldTrump TrumpPoll realDonaldTrump retweet What is the meaning of this Trump Tweet Mr Trump is,0.0,0.0
Samantha Markle,Wed Sep,https t co VP MjWem J The world is a sick place when porn stars are social authorities on human anatomy,-0.22698412698412698,0.3412698412698412
LaylaUSA,Wed Sep,RT RealJamesWoods Yes You re all so worried about the ramifications for the midterms Just call the vote and live or die with it That s,0.13636363636363635,0.5
Linda,Wed Sep,RT NJ Optimist President Trump Needs Our Support Primaries are over Time to UNITE behind the Republican Candidate Voting for rd Party,-0.4,0.7
Karen,Wed Sep,RT JoyceWhiteVance This situation is a crisis of leadership It s not hard to track amp care for people in your custody Gov t does that ev,0.14583333333333334,0.5416666666666666
Andr Borgeld,Wed Sep,thehill RandPaul LindseyGrahamSC realDonaldTrump We against Trump have no President He only does things for and the top,0.25,0.75
Jeff Livingston,Wed Sep,RT RL Anyone who supports President Trump is a drag of society But here you have a creepy Joe Biden molesting women and making them,-0.3,0.5354166666666667
Bularkey,Wed Sep,RT FoxNews Polish president proposes permanent US base called Fort Trump https t co CmyVx iDZM,-0.8,1.0
Stoney DJ,Wed Sep,RT j ooch So anyone who supports Trump is a dreg of society But here you are touching women making them look uncomfortable theres more,0.16666666666666666,0.6666666666666666
Richard D Cappetto,Wed Sep,nypost Who cares she has stated times she never had sex with Trump so when is she lying,0.0,0.0
American as Apple Pie Baklava,Wed Sep,RT ColMorrisDavis Treasury is borrowing bigly to cover massive budget deficit amp tossing it on the growing nat l debt for future generatio,0.0,0.4083333333333334
Texan,Wed Sep,RT TomiLahren It s funny Hillary declares our institutions amp traditions are under siege under President Trump when the shining stars of,0.25,1.0
A Bowen,Wed Sep,RT TheBadDadder If you re as fed up with the Mueller investigation as I am I encourage you to peruse this thread I wrote over the pas,0.0,0.0
jupiter,Wed Sep,Hr Salvini die kriminellen Wirtschaftsfl chtlinge aus Afrika sind nicht die Neuen Sklaven sondern der ganze D https t co SJbQ Alj,0.0,0.0
,Wed Sep,RT alexanderchee The idea that the president can t do this because it is illegal is so quaint it suggests the author woke this morning a,-0.5,0.5
Karma s gonna get you,Wed Sep,RT Redpainter Before I atone tomorrow I m gonna say this I wish nothing but pain misery heartache loss physical aches and ailmen,0.0,0.14285714285714285
KPW,Wed Sep,RT krassenstein Who would have guessed https t co CzYuGnDR,0.0,0.0
SUSAN SIMPSON,Wed Sep,RT BrexitRaab Oot and aboot wi Donald Trump https t co t q,0.0,0.0
ForthrightFox J,Wed Sep,foxandfriends JennaBrowder https t co AgshIYKb,0.0,0.0
Jamo,Wed Sep,That s terrible you should sack whichever moron hired that guy he must be incompetent,-0.7166666666666667,0.7888888888888889
Ellie Mae,Wed Sep,RT petluvers Trump You have to be kidding See Hillary s tweets in article She proves she disagrees with the constitution and founders,0.3,0.0
Richard Kleimeier,Wed Sep,realDonaldTrump WHERE ARE THEY ImpeachTRUMP realDonaldTrump ImprisonTrump TrumpIsPutinsBitch FireThemAll https t co dL AX kLHx,0.0,0.0
JHC,Wed Sep,President Trump to visit North Carolina in hurricane s aftermath The State https t co pwonOSGaM,0.0,0.0
Sandi Ghandi,Wed Sep,RT ImperatorRex I hope that Trump has a revenge lined up for her the likes of which we ve never seen To make sure that her name,0.5,0.8888888888888888
Noni,Wed Sep,RT gspatton BREAKING State Dept Employee outed by James O Keefe Resist everything Every level F ck sh t up Shown on Video IS ac,0.0,0.0
Unknown Person,Wed Sep,RT RealCandaceO I didn t watch the Emmys but I somehow knew exactly what happened Shocker https t co ZLZVQS QoM,0.25,0.25
Jim,Wed Sep,RT GreggJarrett If Rod Rosenstein defies Trump s order to declassify documents he should be fired https t co q wlw s Zo,0.0,0.0
Nelson J D Cunha,Wed Sep,RT DearAuntCrabby Donald Trump ranked worst president in US history by nearly political scientists Only https t co jHxVGY,-0.3333333333333333,0.7000000000000001
Rockie Springer,Wed Sep,RT gatewaypundit Far Left Activist and Kavanaugh Accuser Christine Ford Spotted at Anti Trump March in LA VIDEO https t co btT KxQ XC,0.05,0.5
V gh Lajosn,Wed Sep,RT bulldoghill The release of FISAs like this is off the charts one former Justice Department official wrote Another former federal p,0.0,0.0
Sandyriccobono,Wed Sep,RT beth k a WOW if true this explains it all and they need to move forward with confirming JudgeKavanaugh and share this info with MeT,0.22499999999999998,0.825
Aaron,Wed Sep,RT JesseKellyDC Trump is overseeing a booming economy with economic growth near record low unemployment originalist judges confir,0.10000000000000002,0.30000000000000004
myna,Wed Sep,RT GreggJarrett If Rod Rosenstein defies Trump s order to declassify documents he should be fired https t co q wlw s Zo,0.0,0.0
Bull Moose Progressive Party,Wed Sep,WashTimes The question is do we want a a sexual abuser like Donald Trump in our Supreme Court The Republicans do https t co PRTTuSzDi,0.5,0.8333333333333334
Ellen,Wed Sep,RT true pundit Trump orders feds to declassify key FISA documents text messages in FBI Russia probe https t co jjxROmykBX,0.175,0.825
BopoH,Wed Sep,RT Evan McMullin The president s public release of sensitive information from an ongoing federal investigation into his own organizations,0.2333333333333333,0.6555555555555556
Iv n Vega,Wed Sep,Stormy Daniels revela sus relaciones con Donald Trump en un libro de memorias Gente y Famosos EL PA S https t co Zcgb ZMs v,0.0,0.0
Hey,Wed Sep,RT shaunking Trump administration admits it has lost track of an additional immigrant children that they placed with sponsors ht,0.0,0.0
Matthew Whelan,Wed Sep,I No President has an Attorney General The United States has an Attorney General Despite his fever dreams l https t co MWimszYfXf,0.05000000000000002,0.5
Suzan Parisi,Wed Sep,RT NatashaBertrand Jeff Sessions earlier this month While I am attorney general the actions of the Department of Justice will not be,0.02500000000000001,0.5
Bluzy,Wed Sep,Donald Trump erodes Social Security and Medicare solvency while blaming Democrats USA TODAY https t co sKy t tNBb,0.03333333333333333,0.06666666666666667
Shane,Wed Sep,RT NBCNews President Trump cannot legally send a personalized cellphone message through FEMA s presidential emergency alert system https,0.2,0.2
GloriaChristieReport,Wed Sep,https t co I Cf TfGmi,0.0,0.0
surfanglerchick,Wed Sep,RT bbusa Daughter Of CIA Assassin Paymaster Tries To Bring Down Trump Supreme Court Nominee Kavanaugh https t co J IBsoew E SO DR,-0.1277777777777778,0.34444444444444444
James Michael Walker,Wed Sep,realDonaldTrump without prosperity In other words as some of them are very cynical by nature they re killing de https t co dgbnMHJlaI,-0.4525,0.6875
Joe Biden,Wed Sep,Andrea sweetie I love ya but this is an unforced error https t co CEccR LeEH,0.5,0.6
l O,Wed Sep,trump missed this family the Ahmeds of fairfax virginia racists racism fairfaxvirginia d m v https t co kRvoXtNUea,0.0,0.0
AuntieUppity,Wed Sep,RT MattGertz Trump says that he hasn t read the FISA documents he s ordered declassified but is doing it because many people i e Ha,0.5,0.5
Ronnie Bissinger,Wed Sep,JackPosobiec dcvacco It s bad for National Security but its great for proving obstruction of justice which is on https t co eHwTG xymO,0.0500000000000001,0.7083333333333333
,Wed Sep,VP Mr President Trump it is essential for the next talks with the North Korean leader to be held in Washington f https t co B ZobR IfF,0.0,0.15
betty villatoro,Wed Sep,RT John Yeah I like the evangelicals and Franklin Graham give Donald f Trump a pass on adultery lying and then the bull cra,0.0,0.0
Derp s Bentley,Wed Sep,RT realDonaldTrump The recovery got started on Election Day It took Trump s Tax Cuts and Regulation Cuts to get the economy boomin,0.0,0.0
Jerry Mullins MAGA,Wed Sep,RT Golfinggary President Trump shows boundless courage He stands up for what is right even against overwhelming opposition He is,0.1952380952380952,0.7452380952380953
Carl Bonitz,Wed Sep,Trump Just Declared War On His Own Candidate For Florida s Governor For https t co ythdvOSvLh via YouTube,0.6,1.0
WBW,Wed Sep,RT cbudoffbrown Now this is cool and smart politico s policy and interactive news teams visualize how industries must simultaneously op,0.28214285714285714,0.6464285714285715
Frances Wolf,Wed Sep,RT BJSquirrel It is TERRIFYING amp not enough prople are thinking past this vote and coming to terms with the multitude of ways amp millions,-0.4166666666666667,0.5833333333333334
Donald Trump is,Wed Sep,RT tonyrenier JohnBerman Donald Trump is not intellectually capable to make National Security decisions Despite his claims he is not a,-0.1,0.4
pwithm,Wed Sep,thehill The FBI should only release of the requested documents Or none with the excuse that they re under au https t co dvnZtXlGIY,-0.025,0.525
Grammy Linen,Wed Sep,RT Yamiche I m so sad over Jeff Sessions because he came to me He was the first Senator that endorsed me And he wanted to be Attorney,-0.125,0.6666666666666666
stella,Wed Sep,RT Trump Scoop After DeSantis Breaks With Trump On Maria Death Toll Trump Quietly Fumes https t co ctyn EhTD https t co dRlWI YiM,0.0,0.3333333333333333
TheGURU,Wed Sep,AldaighD MSNBC There are corrupt politicans in most cities some more than others bottom line Trump didn https t co e c qeWkS,0.16666666666666666,0.6666666666666666
nan,Wed Sep,So true,0.35,0.65
HawksFan,Wed Sep,RT realDonaldTrump The recovery got started on Election Day It took Trump s Tax Cuts and Regulation Cuts to get the economy boomin,0.0,0.0
Winnie Eckert RemoveNunes FBR,Wed Sep,RT PaulMayATL Trump s Lies Have Grown Far More Frequent and More Dangerous Mother Jones SmartNews https t co c cPTWVK S,0.12,0.6399999999999999
Steve Lewis,Wed Sep,CNN Hey Trump here is your unsung success Total failure,-0.005555555555555573,0.35000000000000003
Angel W,Wed Sep,RT shaunking Trump administration admits it has lost track of an additional immigrant children that they placed with sponsors ht,0.0,0.0
rez,Wed Sep,RT mehdirhasan The same right wing bloggers who accuse Corbyn of anti Semitism praise Steve Bannon who was the mastermind behind a ridi,-0.038095238095238106,0.45357142857142857
appalledvoter,Wed Sep,RT cstrohm Bloomberg News The FBI did not tell Trump or anyone else at the White House that the bureau doesn t want to be involved in an,0.0,0.0
DW Heikkinen,Wed Sep,RT dbongino Insane liberals Trump colluded with Russia Normal people Do have any evidence of that Insane liberals Not really,-0.48750000000000004,0.7125
Donald Trump is,Wed Sep,RT Marose cstrohm Donald Trump is openly a LIAR why believe what comes outta his mouth,0.0,0.5
jamezdoezthingz,Wed Sep,RT FoxNews Trump says exposing FBI Russia hoax may be crowning achievement of presidency https t co aQHjZGSf,0.0,0.0
Marie Casey,Wed Sep,RT sarahkendzior It s an election that could not be more critical to ending any continuing threat from authoritarian tendencies https,0.25,0.65
JimThomJr,Wed Sep,Add JackBlack to my list of entertainers for which I will not spend my money https t co Ko d fDfj,0.0,0.0
Jenn In NV,Wed Sep,RT SenCortezMasto deportation cases are closed because judges made determinations in the best interests of the kids Yet DHS amp D,0.45,0.2
Daily Post Africa,Wed Sep,Hurricane Florence Trump to visit North Carolina https t co m kv RqC X https t co EuNhesHhqX,0.0,0.0
Itsme,Wed Sep,RT hfinch Let s ask Christopher Steele Nellie Ohr Glenn Simpson that question UNDER OATH A reckoning is coming Grandma Death an,0.0,0.0
D C Lascelle,Wed Sep,RT ddale New item for the running list of things Trump says even his worst enemies think he s right about Trump says even his worst ene,-0.3944805194805195,0.747564935064935
Donald Trump is,Wed Sep,RT SBTL today I woke up and Donald Trump is still the president I went back to sleep,0.0,0.0
Auntie Nan,Wed Sep,RT shomaristone Trump Rolls Back Pollution Rules for Drilling on US Lands https t co hWtDufTrXS,0.0,0.0
Tony Sipe,Wed Sep,RT matthewamiller After a year and a half of Trump making repeated inappropriate demands of the FBI we finally found something he won t,-0.08333333333333333,0.5833333333333334
Gehres GWeed,Wed Sep,RT tribelaw Declassifying FISA documents while the investigation of which they re a part is ongoing is an especially grave species of obs,0.0,1.0
Instytut Obywatelski,Wed Sep,RT washingtonpost The Polish government did everything it could to turn Tuesday s visit into one of the president s more enjoyable moment,0.5,0.55
Jeff,Wed Sep,long ago fired he should be,-0.05,0.4
Lala Downey,Wed Sep,RT RealJamesWoods Does that include Mr Ed https t co p CReXKOrl,0.0,0.0
Donald Trump is,Wed Sep,RT charlotteirene Donald Trump is holding a rally on the campus of my school today in case you re wondering how my life as a sexual ass,0.5,0.8333333333333334
Prudence Cain,Wed Sep,RT sarahkendzior It s an election that could not be more critical to ending any continuing threat from authoritarian tendencies https,0.25,0.65
Cindy Fizer,Wed Sep,RT peterbakernyt Trump calls FBI truly a cancer in our country and says exposing its corruption will be one of my crowning achievement,0.0,0.0
Billy DeRuiter,Wed Sep,https t co NmId OWOGR Trump should order a special oversite to see that documents aren t being destroyed after t https t co hGTjcDHtxJ,0.35714285714285715,0.5714285714285714
Courtney Clift,Wed Sep,RT KimberlyEAtkins And then he went through the nominating process and he did very poorly I mean he was mixed up and confused and peo,-0.23750000000000002,0.5458333333333333
Ricky Rodriguez,Wed Sep,thehill America Trump is one of the dumbest we ve ever seen from the standpoint of intelligence,0.0,0.0
pilliga,Wed Sep,Watch video of an NRA president meeting with an alleged Russian spy https t co Jevp ytdrW via MotherJones,-0.05,0.05
Elizabeth Morrow,Wed Sep,RT kenklippenstein That sucks man whoever appointed him must ve really had it out for you https t co gXulAqJfK,-0.04999999999999999,0.25
Cat,Wed Sep,marklevinshow Wow liberals are so desperate trying to destroy Trump s personal life,-0.175,0.575
